{
  "$schema": "http://json-schema.org/draft-07/schema#",
  "$id": "https://github.com/ApurvBazari/claude-plugins/onboard/schemas/research-findings.json",
  "title": "Onboard Research — Specialist Findings",
  "description": "Structured output contract for one research specialist (built-in or user-supplied). The verifier and synthesizer consume this shape. A specialist that cannot evaluate its dimension returns status 'not-assessed' with an empty claims array.",
  "type": "object",
  "required": ["dimension", "status", "claims"],
  "additionalProperties": false,
  "properties": {
    "dimension": {
      "type": "string",
      "minLength": 1,
      "description": "The dimension this specialist assessed, e.g. 'architecture'."
    },
    "status": {
      "enum": ["assessed", "not-assessed"],
      "description": "'not-assessed' when the specialist could not evaluate the dimension; claims must then be empty."
    },
    "claims": {
      "type": "array",
      "items": {
        "type": "object",
        "required": ["id", "statement", "evidence", "confidence"],
        "additionalProperties": false,
        "properties": {
          "id": { "type": "string", "pattern": "^C[0-9]+$" },
          "statement": { "type": "string", "minLength": 1 },
          "evidence": {
            "type": "array",
            "items": { "type": "string" },
            "description": "path or path:line anchors supporting the claim."
          },
          "confidence": { "type": "number", "minimum": 0, "maximum": 1 },
          "category": { "type": "string", "description": "optional tag, e.g. 'risk', 'convention'." }
        }
      }
    },
    "notes": { "type": "string" }
  }
}
